{
  "meta": {
    "schema_version": "2.0.0",
    "release_id": "2026-09-28-r1",
    "object_id": "KH:banteay-chhmar",
    "slug": "banteay-chhmar",
    "country_code": "KH",
    "country_slug": "kh",
    "generated_at": "2026-09-28T17:50:00+04:00"
  },
  "identity": {
    "name": "Banteay Chhmar",
    "class": "non_touristy",
    "interest": [
      "architecture",
      "archaeology",
      "community",
      "culture"
    ],
    "tags": [
      "architecture",
      "archaeology",
      "community",
      "culture",
      "history",
      "religion",
      "nature",
      "ethnography",
      "urban",
      "rural",
      "guide_or_permit",
      "weather_sensitive",
      "class_non_touristy"
    ],
    "why_go": "Banteay Chhmar — большой храмовый и городской комплекс конца XII–начала XIII века, связанный с Jayavarman VII. Он известен длинными барельефами с военными и придворными сценами, башнями с лицами и изображениями многорукого Avalokiteshvara; значительная часть комплекса остаётся в состоянии руин."
  },
  "location": {
    "region": "Преахвихеа / северный храмовый пояс",
    "nearest_hub": "Сисопхон / Бантеаймеанчей",
    "languages_spoken": [
      "Khmer",
      "куй в отдельных общинах",
      "английский ограниченно распространён вне туристической среды"
    ],
    "currency": {
      "code": "KHR",
      "name": "Cambodian riel",
      "local_currency_per_1_usd": 4068.11,
      "as_of": "2026-09-27",
      "rate_type": "market/reference snapshot",
      "notes": "Доллары США по-прежнему широко используются, особенно в туризме и для крупных платежей; сдачу часто дают в риелях.",
      "practical_notes": "KHR официальная валюта; USD широко используется, особенно в туризме и для более крупных сумм; сдача часто в риелях."
    }
  },
  "editorial": {
    "annotation": {
      "narrative": "Banteay Chhmar — большой храмовый и городской комплекс конца XII–начала XIII века, связанный с Jayavarman VII. Он известен длинными барельефами с военными и придворными сценами, башнями с лицами и изображениями многорукого Avalokiteshvara; значительная часть комплекса остаётся в состоянии руин.",
      "culture_ethnography": "Главное отличие от Angkor — современная деревня и общинного туризма практически встроены в посещение. Местные гиды, проживание в семье, приготовление еды и официальный палаточный лагерь позволяют связать археологию с жизнью нынешнего поселения, не придумывая “деревенскую аутентичность” со стороны.",
      "geography_geology": "Равнинный северо-западный ландшафт; храм окружён рвами, водоёмами, деревней и сетью спутниковых святилищ, поэтому для полного дня полезен велосипед/мототакси, а не только пеший круг главного храма.",
      "myths_legends_beliefs": [
        "Буддийская иконография Avalokiteshvara и лица на башнях связывают Banteay Chhmar с религиозно-политической программой Jayavarman VII; современные ритуалы в деревне нужно фиксировать только по объяснению местного гида."
      ]
    },
    "field_brief": "Banteay Chhmar — большой храмовый и городской комплекс конца XII–начала XIII века, связанный с Jayavarman VII. Он известен длинными барельефами с военными и придворными сценами, башнями с лицами и изображениями многорукого Avalokiteshvara; значительная часть комплекса остаётся в состоянии руин. Главное отличие от Angkor — современная деревня и общинного туризма практически встроены в посещение. Местные гиды, проживание в семье, приготовление еды и официальный палаточный лагерь позволяют связать археологию с жизнью нынешнего поселения, не придумывая “деревенскую аутентичность” со стороны. Равнинный северо-западный ландшафт; храм окружён рвами, водоёмами, деревней и сетью спутниковых святилищ, поэтому для полного дня полезен велосипед/мототакси, а не только пеший круг главного храма. Мифы и поверья: Буддийская иконография Avalokiteshvara и лица на башнях связывают Banteay Chhmar с религиозно-политической программой Jayavarman VII; современные ритуалы в деревне нужно фиксировать только по объяснению местного гида. Сезон: Ноябрь–февраль: суше и прохладнее; март–май очень жарко; май–октябрь сезон дождей."
  },
  "logistics": {
    "access": "Дальний автомобильный маршрут; разумно планировать с местным водителем/гидом и проверять состояние дорог.",
    "last_mile": "от деревенских проживание в семье/общинная туристическая инициатива до главного комплекса обычно сотни метров–~1 км; по главному храму и деревне 2–5 км за день",
    "typical_visit_hours": [
      3,
      5
    ],
    "permit_or_guide": "местный проводник необязателен, но полезен для барельефов и удалённых вторичных объектов",
    "mobility_notes": null,
    "modes": {
      "public_transport": "до Sisophon есть междугородние автобусы/минивэны; от Sisophon до Banteay Chhmar нужен shared/частный такси или трансфер общинная туристическая инициатива",
      "taxi_ridehail": "официальный общинная туристическая инициатива-прайс последнего опубликованного периода указывал частный такси Sisophon около US$25, Сиемреап около US$65 one-way; на 2026 переподтвердить",
      "moped": "можно ехать от Sisophon, но дорога и пыль/грязь сезонно меняются; для спутниковых храмов мото удобно",
      "walking": "от деревенских проживание в семье/общинная туристическая инициатива до главного комплекса обычно сотни метров–~1 км; по главному храму и деревне 2–5 км за день"
    },
    "water": "общинная туристическая инициатива/проживание в семье обеспечивают питьевую воду; на спутниковые храмы брать запас",
    "overnight_and_camping": "редкий случай подтверждённого легального кемпинга: общинная туристическая инициатива организует Adventure Tents в районе главного храма с туалетом, едой, гидом, водой и входным билетом; не путать с самовольной палаткой среди руин",
    "access_requirements": "местный проводник необязателен, но полезен для барельефов и удалённых вторичных объектов",
    "self_guided_default": false,
    "travel_model": "самостоятельно"
  },
  "accommodation": [
    {
      "name": "Banteay Chhmar CBT Homestay",
      "area": "деревня Бантеайчмар",
      "price_for_two": "последний опубликованный общинная туристическая инициатива-прайс (действовал до конца 2025): от US$8 за комнату; варианты с частный bathroom/A/C примерно US$10–16. На 2026 подтвердить у общинная туристическая инициатива",
      "contact": "через Banteay Chhmar Community-Based Tourism",
      "social_or_web": "https://www.visitbanteaychhmar.org/",
      "source": "https://www.visitbanteaychhmar.org/prices-and-tours/"
    },
    {
      "name": "Adventure Tents — Banteay Chhmar CBT",
      "area": "официально организуемый лагерь в районе главного храма или альтернативной точке общинная туристическая инициатива",
      "price_for_two": "опубликованный пакет: US$92 на человека при группе 1–10; включает питание, гида, воду и вход. Это дорогой пакет, но юридически и организационно подтверждённый кемпинг",
      "contact": "через Banteay Chhmar CBT",
      "social_or_web": "https://www.visitbanteaychhmar.org/staying-here/adventure-tents-banteay-chhmar/",
      "source": "https://www.visitbanteaychhmar.org/staying-here/adventure-tents-banteay-chhmar/"
    }
  ],
  "operations": {
    "status": "open_community_managed",
    "hours": "Храмовый комплекс и общинная туристическая инициатива-посещения организуются локально; официальная общинная туристическая инициатива-страница публикует услуги проживание в семье, местный проводник и транспорт, но не единый турникетный график. Для раннего/позднего света лучше договориться с общинная туристическая инициатива заранее.",
    "ticket": "Temple сбор: US$5 по официальной странице Banteay Chhmar общинного туризма; местный проводник для иностранных туристов US$5, дополнительные услуги оплачиваются отдельно.",
    "last_verified": "2026-09-28",
    "official_url": "https://www.tourismcambodia.org/cbet_site/destinations/banteaychhmar",
    "closure_notes": "Удалённый комплекс; после сильных дождей подъезд и грунтовые участки могут быть медленнее. Праздники/церемонии могут менять режим отдельных зон."
  },
  "safety": {
    "main_risks": [
      "UXO/мины вне очищенных маршрутов",
      "жара",
      "удалённость от медицины",
      "состояние дорог после дождя"
    ],
    "country_advisory_note": "На сентябрь 2026 иностранные travel advisories указывают повышенную осторожность из-за преступности, UXO и последствий конфликта на границе с Таиланд; приграничные районы имеют отдельные ограничения."
  },
  "traveler_reports": {
    "recurring_issues": [
      "последний опубликованный официальный прайс на странице подписан как 2025 — использовать его только как ориентир и подтвердить перед поездкой",
      "сезонные дороги влияют на удалённые храмы и место лагеря",
      "часть барельефов/кладки уязвима: не рассчитывать на свободное лазание по руинам"
    ]
  },
  "media": {
    "hero": {
      "url": "https://upload.wikimedia.org/wikipedia/commons/8/88/Banteay_Chhmar_Temple_Entrance.JPG",
      "source_page": "https://commons.wikimedia.org/wiki/File:Banteay_Chhmar_Temple_Entrance.JPG",
      "provider": "Wikimedia Commons",
      "license": "CC BY-SA 3.0",
      "artist": "Andrew Marino",
      "description": null,
      "width": null,
      "height": null,
      "score": null,
      "last_checked": "2026-09-28"
    },
    "gallery": [
      {
        "url": "https://upload.wikimedia.org/wikipedia/commons/8/88/Banteay_Chhmar_Temple_Entrance.JPG",
        "source_page": "https://commons.wikimedia.org/wiki/File:Banteay_Chhmar_Temple_Entrance.JPG",
        "provider": "Wikimedia Commons",
        "license": "CC BY-SA 3.0",
        "artist": "Andrew Marino",
        "description": null,
        "width": null,
        "height": null,
        "score": null,
        "last_checked": "2026-09-28"
      }
    ],
    "photo_suitability_5": 5,
    "video_suitability_5": 5,
    "best_light": "раннее утро и поздний день",
    "visual_scouting": null,